"ID_FAMILIA";"NU_CODIGO_FAMILIA_CBO";"TE_COND_GERAL_EXERC";"TE_DESCRICAO_SUMARIA";"TE_FORMACAO_EXPER";"TE_GLOSSARIO";"TE_NOTAS";"NM_TITULO_FAMILIA"
4139;"9109";"Trabalham em empresas de transporte ferroviário e metrôs. Atuam em locais abertos e fechados, em períodos diurno, noturno ou em rodízio de turnos. Esses empregados são assalariados, registrados em carteira e organizam-se em equipe, sob";"Supervisionam e coordenam a realização de manutenção em vias férreas; supervisionam equipes de trabalho de reparo, manutenção e de restabelecimento de tráfego; inspecionam e realizam testes em vias férreas; supervisionam manutenção mecanizada das vias férreas. As atividades são exercidas em conformidade a normas e procedimentos técnicos, de qualidade, de segurança, de saúde e de preservação do meio ambiente.";"O exercício dessas ocupações requer ensino médio, acrescido de um curso profissionalizante com carga horária superior a quatrocentas horas-aula. O pleno desempenho das atividades ocorre após cinco anos de experiência. A(s); ocu";"";"";"Supervisores de outros trabalhadores de serviços de reparação, conservação e manutenção"
4140;"3751";"Os profissionais da família trabalham, basicamente, no comércio atacadista e varejista, na construção e na prestação de serviços , podendo ser encontrados também em outras atividades, como a indústria. Montam vitrines e";"Projetam e executam soluções para espaços internos residenciais, comerciais, industriais visando a estética, o bem-estar e o conforto. Criam e projetam vitrines, ambientes comerciais, industriais e de eventos que destaquem e valorizem o produto; projetam programações visuais com os objetivos de estimular o consumo de produtos e de informar o consumidor.";"O exercício das ocupações da família, atualmente, não requer um nível de escolaridade determinado, pois no mercado convivem profissionais com formação na prática, cursos de curta duração, cursos técnicos de ";"";"Podem ocorrer casos de designers de interiores, designers de vitrines, visual merchandisers e decoradores de eventos que exercem, concomitantemente outras profissões, como arquitetos, cenógrafos, artistas plásticos, publicitários, organiza";"Designers de interiores, de vitrines e visual merchandiser e afins (nível médio);"
4141;"7311";"Atuam em indústrias de fabricação de materiais elétricos e eletrônicos, máquinas, aparelhos e equipamentos em geral, instrumentos de precisão e ópticos e equipamentos para automação industrial, cronômetros e rel";"Montam, testam e inspecionam placas, aparelhos e, ou equipamentos eletroeletrônicos. Instalam painel de comando de rampa, esteira rolante e elevadores; preenchem relatórios e fichas dos equipamentos. Organizam e mantêm o local de trabalho em condições de uso. Abastecem o posto de trabalho de componentes, peças e materiais.";"A escolaridade requerida é de nível médio mais curso básico de qualificação profissional, até duzentas horas-aula. A experiência profissional para desempenhar plenamente as atividades dessas ocupações é normalme";"Setrab: Assessoria e Consultoria em Segurança do Trabalho Ltda.  Sine: Sistema Nacional de Emprego ";"";"Montadores de equipamentos eletroeletrônicos"
4142;"7253";"Esses profissionais podem atuar em locais fechados, abertos ou em veículos nos horários irregulares. São absorvidos, no trabalho, pelas indústrias de fabricação de máquinas e ou equipamentos, extrativas minerais e outras ativid";"Montam máquinas agrícolas, de terraplenagem e perfuratrizes, inspecionando e fixando peças e conjuntos mecânicos e abastecendo sistemas hidráulicos, de arrefecimento e de lubrificação. Montam equipamentos de levantamento, movimentação e descarga, avaliando condições de locais para instalações, realizando terraplanagem para instalação e montagem, montando e alinhando bases e rampas de plataformas de descarga. Montam equipamentos de extração e beneficiamento de minérios e rochas, tais como alimentadores, peneiras, transportadores de correia e esteira e britadores, entre outros. Instalam equipamentos hidráulicos, pneumáticos, eletro-eletrônicos, mecânicos e de ar condicionado. Ajustam componentes mecânicos, hidráulicos e pneumáticos. Realizam testes em sistemas e componentes.";"O acesso a essas ocupações ocorre após formação do ensino médio, acrescido de um curso profissionalizante superior a quatrocentas horas-aula, preferencialmente voltado à montagem de máquinas pesadas e ou equipamentos agrÃ";"";"";"Montadores de máquinas pesadas e equipamentos agrícolas"
4143;"2413";"Trabalham em cartórios, como empregadores. Atuam em equipe, em ambiente fechado e em horário diurno e horários irregulares (oficial de registro de pessoas naturais);.";"Formalizam juridicamente a vontade das partes, no exercício da função pública delegada pelo estado e de acordo com as determinações previstas em lei. Registram atos e fatos jurídicos, tais como nascimentos, casamentos, óbitos e outros e também as sociedades civis, associações e fundações, os títulos e documentos públicos e particulares, as operações imobiliárias, os contratos marítimos e as embarcações marítimas, a distribuição de títulos, feitos ajuizados e outros documentos; averbam alterações em todos estes atos e fatos. Reconhecem a veracidade de documentos e fatos, conferindo aos documentos forma e autenticidade legal e pública; aconselham e prestam informações ao usuário do serviço.  Conservam o acervo e gerenciam a serventia. Prestam informações.";"O exercício dessas ocupações requer bacharelado em Direito ou dez anos de experiência cartorária. A fé pública para o exercício notarial e de registro é delegada por concurso.";"";"";"Tabeliães e registradores"
4144;"8623";"Atuam na fabricação de produtos químicos, alimentícios e de bebidas e nos segmentos de limpeza urbana, esgoto e atividades conexas, metalurgia básica, saúde e serviços sociais. São empregados com carteira assinada, trabalha";"Monitoram o recebimento de resíduos industriais e urbanos, operam fornos de incineração e controlam o processo de tratamento de água e efluentes. Realizam amostragem de resíduos e efluentes, dosam soluções químicas e operam equipamentos eletromecânicos. Documentam dados do processo de tratamento e controlam materiais e produtos utilizados na estação de tratamento de água, efluentes e resíduos industriais. Trabalham em conformidade a normas e procedimentos técnicos e de qualidade, segurança, higiene, saúde e preservação ambiental.";"Para o operador de estação de tratamento requer-se ensino médio concluído e, para o operador de fornos de incineração, ensino fundamental incompleto. Nos dois casos, exige-se curso básico de qualificação profissional em";"";"";"Operadores de instalações de captação e esgotos"
4145;"7151";"Atuam nas indústrias de construção. São assalariados com carteira assinada que trabalham em equipes especializadas nas diversas etapas da construção: sinalização, obra de arte e terraplenagem, pavimentação, capa e t";"Planejam o trabalho, realizam manutenção básica de máquinas pesadas e as operam. Removem solo e material orgânico ""bota-fora"", drenam solos e executam construção de aterros. Realizam acabamento em pavimentos e cravam estacas.";"Para o exercício dessas ocupações requer-se escolaridade entre quarta e sétima séries do ensino fundamental e curso básico de qualificação profissional de até duzentas horas. O pleno exercício das atividades ocorre ";"Bota-fora: nos serviços de terraplenagem, material que sobra das escavações e é empilhado fora do canteiro das obras (Houaiss);.";"";"Trabalhadores na operação de máquinas de terraplenagem e fundações"
4146;"8114";"Atuam na fabricação de produtos alimentares e bebidas, coque, refino de petróleo, combustíveis nucleares, álcool e produtos químicos. São empregados com carteira assinada, trabalham em equipe (produção em série); so";"Controlam variáveis de processos de destilação, evaporação e reação, operam aparelhos de destilação, de evaporação e reatores, realizam análises físico-químicas de produtos e mantém máquinas e equipamentos em condições de uso. No desempenho das atividades utilizam-se de capacidades comunicativas e trabalham seguindo normas de segurança, higiene, qualidade e preservação ambiental.";"Para o exercício dessas ocupações requer-se, no mínimo, o ensino fundamental concluído. A qualificação profissional ocorre com a experiência prática no próprio local de trabalho e o pleno desempenho das atividades u";"";"";"Operadores de equipamentos de destilação, evaporação e reação"
4147;"6410";"Essas ocupações são exercidas por trabalhadores com carteira assinada empregados na agricultura e na pecuária. O trabalho é exercido em equipe, com supervisão ocasional. O operador de máquina de beneficiamento de produtos agr";"Operam, ajustam e preparam máquinas e implementos agrícolas. Realizam manutenção em primeiro nível de máquinas e implementos. Empregam medidas de segurança e auxiliam em planejamento de plantio.";"Essas ocupações são exercidas por trabalhadores com escolaridade de até quarta série do ensino fundamental. A experiência profissional ocorre com a prática de um a dois anos. A(s); ocupação(ões); elencada(s); nesta ";"Côncavo: instrumento da colhedora de grãos composto por uma série de barras de aço paralelas presas por barras laterais curvas Cortinas: instrumento da colhedora de grãos que auxilia na separação da palha inteira e triturada, g";"";"Trabalhadores da mecanização agrícola"
4148;"3223";"Exercem suas funções em laboratórios ópticos, em estabelecimentos ópticos básicos e plenos, em centros de adaptação de lentes de contato, podendo, ainda, atuar no ramo de vendas e em atividades educativas na esfera da saÃ";"Realizam exames optométricos; confeccionam lentes; adaptam lentes de contato; montam óculos e aplicam próteses oculares. Promovem educação em saúde visual; vendem produtos e serviços ópticos e optométricos; gerenciam estabelecimentos. Responsabilizam-se tecnicamente por laboratórios ópticos, estabelecimentos ópticos básicos ou plenos e centros de adaptação de lentes de contato.  Podem emitir laudos e pareceres ópticos-optométricos.";"O exercício dessas ocupações requer curso técnico de nível médio, oferecido por instituições de formação profissional. O pleno desempenho das atividades profissionais se dá após o período de três a q";"Optótipo: quadro com letras impressas e de vários tamanhos com o qual os oculistas experimentam a agudeza visual";"";"Técnicos em óptica e optometria"
4149;"6221";"Essas ocupações são exercidas predominantemente por profissionais autônomos, com exceção do trabalhador da cultura de cana-de-açúcar, que trabalha como carteira assinada . Atuam  em equipe, com supervisão ocasional, exc";"Plantam e colhem gramíneas. Preparam sementes, mudas e insumos, condicionando o solo para tratamento de cultura. Realizam atividades de armazenamento e beneficiamento da colheita, como moagem, secagem e classificação dos grãos. Executam manutenção de máquinas e equipamentos agrícolas.";"O acesso a essas ocupações é livre, com aprendizado na prática. O pleno desempenho dessas atividades ocorre aproximadamente com um ano de experiência. A(s); ocupação(ões); elencada(s); nesta família ocupacional, demanda";"Aplicar fertilizantes: pode ser pulverizar ou aplicar manualmente Curvas de nível: são construídas de forma descendente a partir do rio, represa ou regadeiras Nivelar solo: nivelar taipas de arroz, regadeiras e canais de irrigação. Sis";"";"Trabalhadores agrícolas na cultura de gramíneas"
4150;"2347";"Exercem suas funções em instituições e entidades de ensino e são contratados na condição de trabalhadores com carteira assinada. Organizam-se em equipes de trabalho e também podem atuar de forma individual. Trabalham com su";"Preparam e ministram aula nas áreas de ciências humanas no ensino superior e orientam trabalhos acadêmicos; elaboram planos de ensino; supervisionam estágio; avaliam processos de ensino-aprendizagem; participam de processos de seleção e avaliação. Prestam assessoria técnico-científica; exercem atividades acadêmico-administrativas e constroem projetos político-pedagógicos. Podem desenvolver atividades de pesquisa e extensão.";"O exercício dessas ocupações requer ensino superior completo e títulos de pós-graduação ou especialização na área. É comum o ingresso e a progressão na carreira por intermédio de concursos, principalment";"GPS: Global Position System - Sistema de Posicionamento Global ";"No mercado de trabalho é comum ocorrerem casos de profissionais que exercem, concomitantemente, funções de professor universitário e pesquisador. Para codificá-los, considerar a atividade principal.  ";"Professores de ciências humanas do ensino superior"
4151;"6134";"Trabalham por conta própria e geralmente utilizam mão-de-obra familiar. Nos picos sazonais de coleta, podem contratar mão-de-obra temporária, que trabalha sob sua supervisão. Os criadores de insetos e animais produtores de veneno execu";"Manejam criação e produção e efetuam colheita de derivados de animais e insetos úteis, tais como: abelha, bicho-da-seda, minhoca e animais produtores de veneno, para produção de cera, mel, casulo, húmus, substâncias venenosas para vacinas etc. Produzem alimentos e controlam pragas e doenças; montam instalações, administram e comercializam produção oriunda dos referidos animais e insetos.";"A escolaridade é heterogênea, variando de nenhuma escolaridade para os sericultores a ensino fundamental para os apicultores e minhocultores. O conhecimento e as habilidades para a execução do trabalho são adquiridos no ambiente famili";"Desopercular favos de mel: retirar opérculos dos favos, para que o mel possa sair deles na centrifugação Melgueira: cortiços com favo de mel pH: logaritmo decimal do inverso da atividade dos íons hidrogênio em uma soluçÃ";"";"Produtores de animais e insetos úteis"
4152;"8301";"Atuam na fabricação de celulose, papel e seus derivados e na indústria editorial e gráfica (edição, impressão e reprodução de gravações); como empregados com carteira assinada. Organizam-se em equipe, sob superv";"Coordenam processos de fabricação de celulose e papel, equipes de trabalho e atividades de manutenção de máquinas e equipamentos. Controlam as variáveis físico-químicas e os insumos do processo de produção. Monitoram a emissão de resíduos industriais, elaboram documentação técnica e administrativa e asseguram o cumprimento de normas e procedimentos de segurança, qualidade, higiene, saúde e preservação ambiental.";"Para o exercício dessas ocupações requer-se ensino médio e curso técnico na área de atuação oferecido por instituições de formação profissional ou escolas técnicas. O pleno desempenho das atividades ocor";"";"";"Supervisores da fabricação de celulose e papel"
4153;"6323";"Trabalham predominantemente em silvicultura, exploração florestal, agricultura, pecuária e serviços relacionados a essas atividades. O trabalho é desenvolvido em equipe, com supervisão ocasional, a céu aberto, no período di";"Extraem e beneficiam fibras, ceras e óleos. Colhem frutos de palmeiras e árvores. Manejam extração e beneficiamento de fibras, ceras e óleos. Plantam árvores de pequi e espécies produtoras de fibras. Armazenam e comercializam matéria-prima e produtos.";"O acesso ao trabalho é livre, sem exigência de escolaridade ou formação profissional. A(s); ocupação(ões); elencada(s); nesta família ocupacional, demandam formação profissional para efeitos do cálculo do nú";"Aceirar área de extração: isolar área de extração para prevenção de incêndios, por exemplo, com faixas de areia Área de secagem: é uma área aberta por capina, na qual é colocada uma lona, onde são es";"";"Extrativistas florestais de espécies produtoras de fibras, ceras e óleos"
4154;"3711";"Trabalham em bibliotecas, centros de documentação, arquivos,por exemplo, em  escolas de ensino fundamental, médio, superior e profissional, associações profissionais, empresas, órgãos de administração pública direta";"Atuam no tratamento, recuperação e disseminação da informação e executam atividades especializadas e administrativas relacionadas rotina de unidades ou centros de documentação ou informação, quer no atendimento ao usuário, quer na administração do acervo, ou na manutenção de bancos de dados. Participam da gestão administrativa, elaboração e realização de projetos de extensão cultural. Colaboram no controle e na conservação de equipamentos. Participam de treinamentos e programas de atualização.";"Para o exercício das ocupações requer-se formação técnica  em biblioteconômia em nível médio e entre quatro e cinco anos de experiência para o exercício pleno das atividades; os auxiliares de biblioteca são tÃ";"Clipping: recorte de jornal.";"";"Técnicos em biblioteconômia"
4155;"2142";"Atuam  na maioria das atividades econômicas com concentração na construção civil. Trabalham na área de planejamento e gerenciamento de projetos construtivos para as mais diversas finalidades. Costumam trabalhar em equipe multidisci";"Elaboram projetos de engenharia civil, gerenciam obras, controlam a qualidade de empreendimentos. Coordenam a operação e manutenção do empreendimento. Podem prestar consultoria, assistência e assessoria e elaborar pesquisas tecnológicas.";"Para o exercício profissional requer-se formação em nível superior em tecnologia em Construção Civil ou Engenharia Civil e registro no CREA, sendo frequente os profissionais portadores de títulos de especialização e p";"";"Podem ocorrer casos de engenheiros civis que também exercem funções de professor no ensino superior ou de pesquisador. Para codificá-los considerar as atividades principais.  Norma regulamentadora: lei nº 5.194, de 24 de dezembro de 19";"Engenheiros civis e afins"
4156;"2149";"O trabalho é exercido em empresas dos mais diversos ramos, embora predomine o ramo industrial onde podemos destacar a metalurgia,  fabricação de máquinas, equipamentos e veículos automotores, produtos alimentares e refino de petról";"Controlam perdas de processos, produtos e serviços ao identificar, determinar e analisar causas de perdas, estabelecendo plano de ações preventivas e corretivas. Desenvolvem, testam e supervisionam sistemas, processos e métodos produtivos, gerenciam atividades de segurança do trabalho e do meio ambiente,  planejam empreendimentos e atividades produtivas  e coordenam equipes, treinamentos e atividades de trabalho.";"As ocupações da família requerem curso de Engenharia ou de Tecnologia nas áreas de Produção Industrial e Segurança do Trabalho, com registro no CREA, seguido ou não de cursos de especialização. Na área de proces";"ART:  Anotações de Responsabilidade Técnica. PCA: Programa de Conservação Auditiva. PPR:  Programa de Prevenção Respiratória. PPRA: Programa de Prevenção de Risco Ambiental. CEP: Controle Estatístico de Processo";"Norma Regulamentadora: Lei nº 5.194, de 24 de dezembro de 1966 - regula o exercício das profissões de Engenheiro, Arquiteto e Engenheiro Agrônomo e dá outras providências.  Lei nº 8.195, de 26 de junho de 1991 - altera a lei nu";"Engenheiros de produção, qualidade, segurança e afins"
4157;"3421";"Trabalham em empresas de transportes intermodais,  predominantemente em empresas de transporte aéreo, aquaviário e terrestre. Os profissionais do transporte multimodal podem trabalhar de forma presencial e a distância, por rodízio de turno";"Controlam, programam e coordenam operações de transportes em geral; acompanham as operações de  embarque, transbordo e desembarque de carga. Verificam as condições de segurança dos meios de transportes e equipamentos utilizados, como também, da própria carga. Supervisionam armazenamento e transporte de carga e eficiência operacional de equipamentos e veículos. Controlam recursos financeiros e insumos, elaboram documentação necessária ao desembargo de cargas e atendem clientes. Pesquisam preços de serviços de transporte, identificam e programam rotas e informam sobre condições do transporte e da carga.";"Os profissionais dessa família ocupacional, em sua maioria, possuem formação pós ensino médio, com especialização ou graduação tecnológica na área de transportes. O pleno desempenho das atividades  ocorre apu";"Estufagem = carregar, encher ou adequar a carga no contêiner.";"";"Especialistas em logística de transportes"
4158;"2222";"Atuam em um amplo campo de trabalho, em indústrias tradicionais como alimentos e bebidas. Trabalham em equipes multidisciplinares, podendo supervisioná-la ou serem supervisionados. São empregados, majoritariamente, em empresas privadas. Paa o ";"Desenvolvem produtos e processos da área de produção de alimentos, controlando sua qualidade. Gerenciam processos e elaboram projetos de produção de alimentos. Coordenam equipes e podem prestar consultoria, assessoria e assistência técnica.";"O exercício das ocupações requer formação em Engenharia de Alimentos ou em curso superior de tecnologia em áreas afins, com registro no CREA.";"PIQ - Padrão de Identidade de QualidadeVida de prateleira (shlef-life); - ValidadeOHSAS, ISO - Programas de qualidadePOP - Procedimento OperacionalSIF - Serviço de Inspeção FederalSIM - Ser";"";"Engenheiros de alimentos e afins"
4159;"2132";"No setor industrial estão presentes na extração de minérios, petróleo e gás natural, na fabricação de alimentos e bebidas, de produtos químicos, na produção de combustíveis diversos. Também são empre";"Realizam ensaios, análises químicas e físico-químicas, selecionando metodologias, materiais, reagentes de análise e critérios de amostragem, homogeneizando, dimensionando e solubilizando amostras. Produzem substâncias, desenvolvem metodologias analíticas, interpretam dados químicos, monitoram impacto ambiental de substâncias, supervisionam procedimentos químicos, coordenam atividades químicas laboratoriais e industriais.";"Para o acesso às ocupações requer-se curso superior em nível de tecnologia ou bacharelado completo, na área de Química e afins, sendo que há titulares que são pós-graduados e/ou especializados. Em média, o exercå";"homogeneizar = deixar a amostra uniforme (misturar);quartear = fracionar em quatro partes ensaio = testeamostra = uma parte";"";"Químicos"
4160;"7162";"Atuam na indústria de construção. O telhador (telhas metálicas); também pode atuar em indústrias de fabricação de telhas metálicas.  São empregados assalariados com carteira assinada. Os telhadores de telhas de argi";"Planejam serviços de cobertura de edificações. Confeccionam e montam estruturas de madeira ou metal para cobertura;  colocam telhas de argila, amianto, metálica ou plástico. Operam máquinas e ferramentas para madeira ou metal.";"Para o exercício dessas ocupações requer-se escolaridade entre quarta e sétima séries do ensino fundamental e curso básico de qualificação profissional de quatrocentas horas-aula. O exercício pleno das atividades ocorre";"";"";"Telhadores (revestimentos rígidos);"
4161;"8415";"Atuam na pecuária e atividades afins e na fabricação de produtos alimentares e bebidas como empregados com carteira assinada. O trabalho é presencial, realizado em equipe, sob supervisão ocasional, em ambiente fechado e no horário ";"Recepcionam e analisam o leite, interpretando cronogramas de coleta de amostras, coletando amostras para análise laboratorial, interpretando resultados das análises, definindo proporções de misturas de agentes químicos, divulgando resultados de análises para setores de produção. Controlam variáveis do processo de pasteurização (pressão, temperatura, teor de gordura e outras);. Pasteurizam, desnatam e esterilizam o leite. Realizam procedimentos de sanitização.Trabalham em conformidade a normas e procedimentos técnicos e de qualidade, segurança, higiene, saúde e preservação ambiental. ";"Para o exercício dessas ocupações requer-se ensino fundamental concluído e curso básico de qualificação profissional de duzentas horas-aula. O pleno desempenho das atividades ocorre com até um ano de experiência profiss";"";"";"Trabalhadores na pasteurização do leite e na fabricação de laticínios  e afins"
