"ID_FAMILIA";"NU_CODIGO_FAMILIA_CBO";"TE_COND_GERAL_EXERC";"TE_DESCRICAO_SUMARIA";"TE_FORMACAO_EXPER";"TE_GLOSSARIO";"TE_NOTAS";"NM_TITULO_FAMILIA"
2;"0101";"O trabalho do oficial general é exercido em organizações militares e em instituições civis da administração federal responsáveis pelo desenvolvimento das políticas públicas do governo. O acesso ao primeiro posto de ";"As funções deste grupo consistem em manter, cumprir e defender a constituição federal dentro da sua esfera de atribuições; observar as leis; promover as condições de segurança necessárias para o desenvolvimento e o bem-estar geral; e defender a integridade territorial e a soberania do país. Para isto, dirigem e orientam órgãos superiores das forças armadas; planejam e conduzem os diversos assuntos da área militar; e assessoram na realização das políticas públicas na esfera federal.";"Geralmente os oficiais generais contam com mais de 35 anos de experiência profissional e possuem os cursos de altos estudos militares e de política e estratégia, feitos na escola superior de guerra (esg); ou nas escolas de altos estudos milita";"";"Esta família ocupacional foi descrita por meio de entrevistas conduzidas diretamente pela divisão da classificação brasileira de ocupações - dcbo do ministério do trabalho e emprego - mte.";"Oficiais generais das forças armadas"
14;"0201";"Trabalham no comando de unidades da polícia militar e no apoio ao comando geral, como estatutários; os coronéis são responsáveis pelos comandos regionais, os tenentes-coronéis respondem pelos comandos de áreas ou batalhões ";"Comandam unidades de polícia militar e elaboram plano diretor da instituição. Planejam ações estratégicas, definem ações táticas e executam ações operacionais. Gerenciam atividades administrativas, administram recursos humanos e mantêm hierarquia e disciplina.";"Para o exercício dessas ocupações requer-se curso de formação de oficiais em academia da polícia militar. A ascensão aos postos de oficiais superiores ocorre de forma  gradual, geralmente após mais de cinco anos de oficiala";"";"Os servidores militares das polícias militares são regidos pelo artigo 42 da constituição federal de 1988 e pelas respectivas constituições estaduais.";"Oficiais superiores da polícia militar"
21;"0202";"Trabalham em corporações da polícia militar, como estatutários, no comando de batalhões; realizam trabalho em equipe, sob supervisão. Trabalham em ambiente fechado, a céu aberto ou em veículos, em horários diversos: diu";"Comandam operações de polícia ostensiva, planejam ações de policiamento ostensivo, desenvolvem policiamento comunitário. Gerenciam companhia de polícia e assessoram comando. Exercem poder disciplinar e presidem feitos de polícia judiciária militar.";"Para o exercício dessas ocupações requer-se curso de formação de oficiais em academia da polícia militar e especialização profissional. O exercício pleno da ocupação ocorre com mais de cinco anos de experiên";"";"Os servidores militares das polícias militares são regidos pelo artigo 42 da constituição federal de 1988 e pelas respectivas constituições estaduais.";"Capitães da  polícia militar"
28;"0203";"Trabalham na polícia militar, no comando de pelotões, como estatutários. Trabalham em equipe, sob supervisão. Atuam em ambiente de trabalho que pode ser fechado, a céu aberto ou em veículos, em horários diversos: diurno, noturn";"Comandam pelotão, coordenam policiamento ostensivo, reservado e velado; assessoram comando, gerenciam recursos humanos e logísticos, participam do planejamento de ações e operações, desenvolvem processos e procedimentos administrativos militares, atuam na coordenação da comunicação social;  promovem estudos técnicos e capacitação profissional.";"Para o exercício dessas ocupações requer-se curso de formação de oficiais em academia da polícia militar.";"IPM: Inquérito Policial Militar OPM: Organização Policial Militar ";"Os servidores militares das polícias militares são regidos pelo artigo 42 da constituição federal de 1988 e pelas respectivas constituições estaduais.";"Tenentes da polícia militar"
35;"0211";"Trabalham na polícia militar, como estatutários, atuando em equipe, sob supervisão ocasional. O ambiente de trabalho pode ser fechado, a céu aberto e em veículos. O horário pode ser diurno, noturno, em rodízio de turnos e hor";"Comandam o grupo e a guarda do quartel. Assessoram o comando, administram as atividades da unidade e participam na formação de policiais. Supervisionam policiamento ostensivo e organizam processos e procedimentos administrativo-militares. Atendem a ocorrências e as apresentam à autoridade competente. Prestam serviços comunitários.";"Para o exercício dessas ocupações requer-se escolaridade de nível médio e cursos profissionalizantes de nível técnico realizados em escolas da polícia militar. O exercício pleno das atividades ocorre, em média, ap";"";"Os servidores militares das polícias militares são regidos pelo artigo 42 da constituição federal de 1988 e pelas respectivas constituições estaduais.";"Subtenentes e sargentos da polícia militar"
42;"0212";"Trabalham em corporações da polícia militar, como estatutários; atuam de forma individual ou em equipe com supervisão permanente; o ambiente de trabalho pode ser fechado, a céu aberto ou em veículos. O horário pode ser diur";"Realizam policiamento ostensivo preventivo fardado e atendem e solucionam ocorrências. Executam atividades operacionais e policiamento reservado. Restabelecem ordem pública, controlam distúrbios civis e garantem cumprimento de mandado judicial.";"Para o exercício dessas ocupações requer-se escolaridade de nível médio e qualificação profissional de nível técnico. O exercício pleno da ocupação de cabo da polícia militar ocorre após um a dois an";"Preservar integridade física dos cidadãos: intervenção em ¿operações de desinteligência¿, isto é, brigas familiares, brigas de rua geradas por excesso de ingestão de bebidas alcoólicas, brigas de vizinhos et";"Os servidores militares das polícias militares são regidos pelo artigo 42 da constituição federal de 1988 e pelas respectivas constituições estaduais.";"Cabos e soldados da polícia militar"
49;"0301";"Comandam unidades do corpo de bombeiros militar. Nas cidades maiores, as unidades são comandadas por tenentes-coronéis e nas cidades menores, as sub-unidades são comandadas por majores. Os coronéis ocupam cargos de comando geral, os tenent";"Definem estratégias e comandam unidades operacionais e administrativas do corpo de bombeiros, destinadas à proteção da vida e patrimônio do cidadão e ao meio ambiente. Gerenciam pessoal e recursos financeiros; controlam logística e dirigem serviços de inteligência e de prevenção, de acordo com normas da instituição.";"O acesso ao trabalho requer formação de nível superior, em academias militares. Para major e tenente-coronel requer-se pós-graduação em áreas de segurança, socorro e proteção públicos; para os coronéis hå";"";"";"Oficiais superiores do corpo de bombeiros militar"
56;"0302";"Atuam em unidade do corpo de bombeiros militar. Estão organizados em equipes de resgate, salvamento, combate a incêndio ou de produtos perigosos, sob supervisão ocasional de superiores no comando. Podem trabalhar em ambientes fechados, a cå";"Desenvolvem atividades administrativas em nível tático e operacional de bombeiro militar. Exercem funções de assessoramento e de comando de companhias de bombeiro militar, em espaço geográfico atribuído a um grupamento de bombeiros. Para tanto, administram recursos humanos, materiais e financeiros; comandam atividades de prevenção de sinistros; planejam atividades operacionais e administrativas.  Administram e coordenam atividades de emergências e de combate a incêndios. Estabelecem parcerias com instituições afins e assessoram o comando em atividades operacionais e administrativas.";"O exercício dessa ocupação requer curso de nível superior na área de segurança pública, para situações de emergência e calamidade pública. O pleno desempenho profissional ocorre após cinco anos de atuaçu";"";"";"Oficiais intermediários do corpo de bombeiros militar"
63;"0303";"Trabalham em unidades do corpo de bombeiros militar. Atuam em equipes de cooperação, sob supervisão de oficiais com patente superior. Podem trabalhar em ambientes fechados, abertos ou em veículos, e em horários irregulares. Estão s";"Comandam pelotão e postos de bombeiros; coordenam serviços operacionais; atuam na prevenção e normatização de sistemas e equipamentos de prevenção e combate a incêndio. Planejam atividades operacionais e administrativas e administram recursos humanos, financeiros e logísticos. Desenvolvem atividades de ensino e instrução e cuidam das informações e da comunicação social do corpo de bombeiros.";"Para o exercício profissional requer-se formação superior completa. Os aspirantes a tenente sem curso superior deverão ter quinze anos de experiência e aprovados em concurso interno na corporação.";"EPR : Equipamento de Proteção Respiratória";"";"Tenentes do corpo de bombeiros militar"
70;"0311";"Atuam nos órgãos da administração pública, defesa e seguridade social e estão organizados por equipes de resgate, de salvamento, de produtos perigosos ou de combate a incêndio, sob supervisão constante de profissionais de p";"Previnem sinistros e acidentes; realizam salvamento, combatem incêndios e prestam atendimento pré-hospitalar.  Controlam acidentes com produtos perigosos, comandam equipes de serviços de prontidão e chefiam guarnições.  No desenvolvimento das atividades, a rapidez e a eficácia da comunicação são cruciais, tanto para atender ocorrências como para tranquilizar vítimas e orientar a população.";"Para ingressar nessas ocupações é exigida formação de ensino médio, acrescida de curso profissionalizante com duração superior a quatrocentas horas-aula, ministrado em escolas especializadas. O pleno exercício profissio";"";"";"Subtenentes e sargentos do corpo de bombeiros militar"
77;"0312";"Trabalham no corpo de bombeiros militar. Podem trabalhar em locais fechados, abertos ou em veículos, em períodos diurnos, noturnos e em plantões. O exercício do trabalho pode ser presencial ou a distância. Trabalham sob supervisão ";"Realizam resgates e salvamentos; combatem incêndios;  previnem acidentes e sinistros; preparam-se para ocorrências.  Atendem ocorrências com produtos perigosos.  Trabalham conforme normas e procedimentos técnicos, de segurança e preservação do meio ambiente. Estabelecem comunicação, criando e transmitindo informações, transmitindo e recebendo mensagens.";"O exercício profissional requer ensino médio. A profissionalização ocorre no próprio local de trabalho, após treinamento com carga horária superior a quatrocentas horas-aula.";"";"";"Cabos e soldados do corpo de bombeiros militar"
377;"2011";"O trabalho é exercido em ambientes fechados e controlados de laboratórios de serviços e pesquisa na área de saúde e em complexos hospitalares de excelência, na fabricação de equipamentos e instrumentos, de produtos quím";"Manipulam material genético, sintetizando sequências de dna, construindo vetores, modificando genes 'in vivo' e 'in vitro', manipulando expressão gênica e gerando organismos geneticamente modificados. Analisam genoma, sequenciado-o, identificando genes e marcadores genéticos; aplicam técnicas de reprodução e multiplicação de organismos; produzem compostos biológicos e desenvolvem equipamentos, dispositivos e processos de uso biológico. Elaboram projetos de pesquisa em biotecnologia e bioengenharia.";"Essas ocupações são exercidas por pessoas com formação universitária, geralmente pós-graduadas, após três ou quatro anos de exercício profissional, sob supervisão ocasional de profissional experimentado nas å";"ADN: sigla de ácido desoxirribonucleico. Sigla em inglês DNA.   ARN: ácido ribonucleico. Sigla em inglês RNA. DNA: desoxyribonucleic acid. RNA: sigla em inglês para ribonucleic acid. Genes: sequência de DNA; código para um ";"(1); Na CIUO 88 não existe codificação específica para os profissionais da biotecnologia. Por aproximação, podem ser classificados na família 2211 - Biólogos, botânicos, zoólogos e afins (2); Os técnicos de nÃ";"Profissionais da biotecnologia"
382;"2012";"Esses trabalhadores atuam em áreas de pesquisa e  desenvolvimento, fabricação de máquinas e equipamentos, aparelhos e materiais, equipamentos de instrumentação e outras atividades empresariais. São empregados com carteira assin";"Realizam calibrações, ensaios e medições, asseguram rastreabilidade à medição, produzem padrão e materiais de referência, realizam pesquisa e desenvolvimento em metrologia; projetam, gerenciam e avaliam laboratórios de metrologia. Elaboram documentos técnicos e disseminam conhecimentos metrológicos.";"Para ingressar nessas ocupações requer-se  curso superior completo em  Física, Engenharia, Engenharia têxtil, Administração, dentre outros, seguido de curso de especialização em Metrologia com duração entre duzentas";"Cadeia de medição: padrões, instrumentos e métodos. Grandezas de influência: vibração, temperatura, ventilação etc., ou seja, parâmetros externos que alteram o meio e a grandeza medida.  Rastreabilidade: o que forne";"";"Profissionais da metrologia"
392;"2030";"Trabalham em empresas e instituições de pesquisas públicas ou privadas e em universidades,  nas áreas de saúde humana, animal e vegetal e em pesquisa  e desenvolvimento. O trabalho é desenvolvido, na maioria das vezes, em equipe mu";"Os profissionais desta família desenvolvem atividades de pesquisa em ciências biológicas, elaboram projetos, coordenam equipes , coletam, tratam  e analisam material biológico , dados e informações, geram conhecimentos, métodos e técnicas e divulgam resultados de pesquisa. Podem prestar serviços de assessoria e consultoria técnica e científica , como também podem dar aulas, planejar cursos e eventos científicos.";"As ocupações requerem do profissional o curso superior completo, bem como  cursos de pós-graduação e especialização, principalmente em Ciências biológicas e áreas afins. É comum  o ingresso e a progressão na";"";"No mercado de trabalho é comum ocorrerem casos de profissionais  que exercem, concomitantemente, funções de pesquisador e de  professor universitário. Para a codificação desses casos considerar as atividades principais. ";"Pesquisadores das ciências biológicas"
397;"2031";"Os profissionais da família atuam, principalmente,  em pesquisa e desenvolvimento e no ensino, geralmente em universidades e instituições de pesquisas públicas ou privadas. Desenvolvem suas atividades em equipes e seu vínculo de trabal";"Desenvolvem pesquisas científicas em ciências naturais e exatas tais como, computação e informática, meio ambiente, química, física e matemática, coletando, analisando e tratando  dados físicos, químicos, biológicos, culturais e de fontes secundárias. Criam metodologias, técnicas, equipamentos e ferramentas para pesquisa com a realização de experimentos e a construção de modelos e teorias. Elaboram projetos e coordenam atividades de pesquisa, formam recursos humanos, disseminam conhecimentos científicos. Podem prestar serviços de consultoria, realizar avaliações em p&d, bem como dar aulas.";"Os titulares dessas ocupações detêm escolaridade mínima de nível superior completo e é comum apresentarem formação pós-universitária. A experiência anterior exigida pode variar conforme o local do exercício ";"";"No mercado de trabalho é comum ocorrerem casos de profissionais que exercem, concomitantemente, as funções de pesquisador e professor universitário. Para a codificação desses casos considerar as atividades principais. ";"Pesquisadores das ciências naturais e exatas"
402;"2032";"Os profissionais atuam, principalmente, em universidades públicas ou em centros de pesquisas vinculados a grandes empresas públicas, em diversas áreas como, por exemplo, em pesquisa e desenvolvimento, ensino, administração pública,";"Desenvolvem materiais, produtos, processos e métodos relacionados à engenharia e tecnologia, projetando e especificando equipamentos, protótipos e plantas-piloto e testando protótipos, materiais, processos e parâmetros de operação de plantas-piloto. Participam da qualificação, certificação e homologação de laboratórios e produtos. Planejam e executam pesquisas, gerenciam informações de c&t. Podem também prestar serviços de consultoria técnica, bem como  dar aulas.";"As ocupações da família requerem como escolaridade mínima o superior completo, sendo frequente profissionais com cursos de pós-graduação e especialização. Normalmente são engenheiros e profissionais com conhecim";"";"No mercado de trabalho é comum ocorrerem casos de profissionais que exercem, concomitantemente, funções de pesquisador e professor universitário. Para a codificação desses casos considerar as atividades principais.";"Pesquisadores de engenharia e tecnologia"
407;"2033";"Atuam em pesquisa básica e experimental, em desenvolvimento experimental e também no ensino. Geralmente  são empregados  com carteira assinada. Trabalham predominantemente em instituições de pesquisa, em universidades  e em grandes emp";"Os profissionais desta família desenvolvem pesquisas em ciências da saúde, nas áreas de clínica médica,  medicina básica,  medicina veterinária e em saúde coletiva e, para tanto, elaboram e planejam projetos de pesquisa, formam recursos humanos em pesquisa e divulgam resultados e informações. Podem prestar  assistência comunitária , orientar políticas públicas e prestar assessorias na área das ciências da saúde. Podem também ministrar aulas.";"O exercício ocupacional requer curso superior completo na área de ciências da saúde, sendo frequentes as titulações de especialistas, mestres, doutores. O tempo mínimo de experiência em pesquisa para atingir a titularid";"Medicina básica: anatomia, citologia, fisiologia, genética, farmácia, farmacologia, toxicologia, imunologia, imuno hematologia, química clínica,  microbiologia clínica, patologia. Clínica médica: anestesiologia, pediatria, gi";"No mercado de trabalho é comum ocorrerem casos de profissionais que exercem, concomitantemente, funções de pesquisador e de professor universitário. Para a codificação desses casos, considerar as atividades principais. ";"Pesquisadores das ciências da saúde"
412;"2034";"Trabalham nas esferas pública e privada, em instituições de pesquisa, empresas e universidades, principalmente nos setores agropecuário, de pesca e aquicultura e silvicultura, inseridos em equipe multidisciplinar, cujos membros  podem ";"Executam projetos de pesquisa e desenvolvimento tecnológico em agricultura, pesca, aquicultura, zootecnia e ciências florestais, implantando experimentos e unidades de observação, acompanhando a execução das atividades, realizando medições, pesagens, contagens e diagnósticos. Organizam e analisam os dados coletados. Elaboram e planejam  projetos de pesquisa e divulgam informações. Formam recursos humanos, podem prestar serviços de assessoria, de consultoria e ministrar aulas.   ";"A escolaridade mínima exigida é a formação  superior completa na área, sendo frequente profissionais com cursos de pós-graduação. De uma forma geral, o ingresso na carreira  pode se dar como auxiliar ou assistente de pe";"Eventos de divulgação: dias de campo, cursos técnicos, visitas técnicas, unidades de demonstração, unidades de observação. Unidade de experimentação ou observação:  tanque de peixe, baía de suíno, viveir";"No mercado de trabalho é comum ocorrerem casos  de profissionais que exercem, concomitantemente, funções de pesquisador e de professor universitário. Para a codificação desses casos considerar as atividades principais.  ";"Pesquisadores das ciências da agricultura"
417;"2035";"Atuam em uma grande gama de atividades econômicas, dentre as quais os serviços sociais e de saúde, a administração pública, as atividades recreativas, esportivas e culturais, a pesquisa e desenvolvimento, o ensino. Costumam trabalh";"Formulam objeto de estudo e pesquisa sobre relações humanas e sociais nas áreas das ciências  sociais e humanas. Realizam procedimentos para coleta, tratamento, análise de dados e informações  e disseminam resultados de pesquisa. Planejam e coordenam atividades de pesquisa. Podem dar aulas.";"As ocupações requerem, para o seu exercício, no mínimo o curso universitário completo e mestrado  ou cursos de especialização nas áreas  de conhecimento abrangidas nesta família, quais sejam: Filosofia, História, Ps";"";"No mercado de trabalho é comum ocorrerem casos de profissionais que exercem concomitantemente, funções de pesquisador  e professor universitário. Para a codificação desses casos considerar as atividades principais. ";"Pesquisadores das ciências sociais e humanas"
422;"2041";"Esses profissionais atuam nas áreas ligadas à administração pública, defesa e seguridade social. São assalariados e se organizam em equipe. Trabalham com supervisão ocasional, em ambiente fechado, a céu aberto e em veíc";"Elaboram laudo pericial criminal, organizando provas e determinando as causas dos fatos. Examinam locais de crime, buscando evidências, selecionando e coletando indícios materiais e encaminhando peças para exames com ou sem quesitos. Reconstituem fatos, analisam peças, materiais, documentos e outros vestígios relacionados a crimes, fotografando e identificando as peças e materiais e definindo tipo de exame. Efetuam medições e ensaios laboratoriais, utilizando e desenvolvendo técnicas e métodos científicos.";"O acesso à ocupação é feito por concurso público, que requer curso superior completo. Em seguida, devem cursar e ser aprovados no Curso de Formação de Peritos Criminais.";"DNA: sigla em inglês para ácido desoxirribonucléico. ";"";"Peritos criminais"
427;"2111";"Os profissionais da Matemática aqui descritos são entendidos como Matemáticos aplicados que atuam no setor produtivo de empresas privadas e na administração pública. Trabalham de forma individual e em equipe multidisciplinar,  sem ";"Elaboram modelos matemáticos e lógicos, identificando problemas e situações de interesse, selecionando métodos e técnicas, criando métodos, descrevendo modelos em linguagem matemática, processando simulações computacionais, validando, documentando, implementando e refinando modelos. Realizam atividades de pesquisa em matemática, tratam dados e informações, desenvolvem produtos e sistemas, executam auditoria atuarial. Podem dar aulas e prestar consultorias técnicas.";"O acesso às ocupações é dado por formação de nível superior, sendo comum profissionais portadores de títulos de especialização, mestrado ou doutorado.  ";"Resultados : referem-se a teoremas, corolários e teorias etc. Conjectura: o mesmo que hipótese, mas entre os matemáticos este é o termo recorrente.  Reservas Técnicas : reserva obrigatória para honrar benefícios futuros associa";"É comum encontrar no mercado de trabalho casos de profissionais da matemática que também são professores em diversos níveis de ensino. Para codificá-los, considerar as atividades principais.";"Profissionais da matemática"
432;"2112";"Atuam em três grandes áreas da estatística: a industrial, a aplicada às ciências biológicas e da saúde e a aplicada às ciências humanas e sociais. No exercício das suas atividades se utilizam da estatística como";"Desenham amostras; analisam e processam dados; constroem instrumentos de coleta de dados; criam banco de dados; desenvolvem sistemas de codificação de dados; planejam pesquisa; comunicam-se oralmente e por escrito.";"Para o acesso às ocupações requer-se curso superior completo, sendo desejável curso superior de tecnologia (tecnólogo);, cursos de especialização ou de pós-graduação. O exercício pleno das atividades, em méd";"";"É comum encontrar no mercado de trabalho casos de profissionais da estatística que também são  professores em diversos níveis de ensino. Para codificá-los considerar as atividades principais.";"Profissionais de estatística"
