"ID_FAMILIA";"NU_CODIGO_FAMILIA_CBO";"TE_COND_GERAL_EXERC";"TE_DESCRICAO_SUMARIA";"TE_FORMACAO_EXPER";"TE_GLOSSARIO";"TE_NOTAS";"NM_TITULO_FAMILIA"
1338;"3322";"Atuam na área de ensino profissionalizante, organizando-se de forma individual ou em equipe. Alguns profissionais de entidades sociais desenvolvem atividades pedagógicas e extra-curriculares com os alunos, onde a atuação do professor junto";"Ministram aulas e ensinam práticas profissionais em entidades de ensino profissionalizante; esclarecem dúvidas de alunos; pesquisam e estudam produtos, técnicas de produção e técnicas artesanais e artísticas para preparação de aulas e desenvolvimento de cursos orientados para a comunidade. Acolhem e orientam alunos sobre postura profissional, ética, cidadania e meio ambiente. Avaliam o desempenho dos alunos. Organizam o ambiente de trabalho e executam atividades administrativas.";"Essa ocupação requer o ensino fundamental completo. Vários docentes de cursos profissionalizantes são ""leigos"" do ponto de vista da disciplina específica que lecionam, tornando-se professores devido à sua experiência no exerc";"";"";"Professores práticos no ensino profissionalizante"
1345;"3331";"Exercem suas funções em instituições de ensino, basicamente em escolas que oferecem cursos livres. Atuam de forma individual e também em equipe; trabalham com supervisão  ocasional e, dependendo da característica do curso, pode";"Os profissionais dessa família ocupacional devem ser capazes de criar e planejar cursos livres, elaborar programas para empresas e clientes, definir materiais didáticos, ministrar aulas, avaliar alunos e sugerir mudanças estruturais em cursos.";"O exercício dessas ocupações é livre. Requer-se escolaridade e qualificação profissional variadas, dependendo da área de atuação. Os cursos livres não estão sujeitos à regulamentação do mec. A(s); oc";"";"";"Instrutores e professores de cursos livres"
1359;"3411";"Atuam nas empresas de transporte aéreo, no interior de aeronaves, em horários irregulares. Os mecânicos de vôo são assalariados, com registro em carteira, as demais ocupações são exercidas por profissionais autônomos. T";"Operam aeronaves de pequeno porte para transporte de passageiros ou de cargas ou na realização de serviços especializados, tais como: pulverização agrícola, aerofotogrametria, propaganda aérea, lançamento de paraquedistas e outros, manejando sistemas gerais e comandos, aplicando regras de tráfego aéreo e procedimentos de segurança. Planejam as atividades de voo; inspecionam aeronaves em terra, externa e internamente; contatam órgãos de controle e outras aeronaves, buscando informações diversas sobre meteorologia, tráfego aéreo, situações nos aeroportos, e preenchem documentação de bordo.  Podem atuar em operações de combate a incêndio, salvamento, resgate e   treinar alunos novos ou pilotos em aeronaves específicas.";"Essas ocupações são exercidas por profissionais autônomos com habilitações específicas, nas áreas em que estiverem atuando. Requer-se formação de nível médio, acrescida de cursos profissionalizantes, com dur";"Comissaria: local de trabalho dos comissários de bordo.";"Norma regulamentadora: lei nº 7.183, de 5 de abril de 1984 - regula o exercício da profissão de aeronauta e dá outras providências. Portaria interministerial nº 3.016, de 5 de fevereiro de 1988 - expede instruções para a ex";"Pilotos de aviação comercial, mecânicos de vôo e afins"
1366;"3412";"Os profissionais dessa família ocupacional exercem suas funções em empresas de transporte aquaviário, de navegação marítima ou fluvial, indústria da pesca ou de atividades anexas e auxiliares do transporte. São contrata";"Navegam, atracam e desatracam embarcações; gerenciam tripulação; operam equipamentos de embarcação; monitoram carga e descarga da embarcação e controlam embarque e desembarque de passageiros.  Registram dados da embarcação; supervisionam manutenção de embarcações e administram recursos materiais e financeiros.";"Essas ocupações são exercidas por pessoas com escolaridade de ensino fundamental concluído, acrescida de curso básico de qualificação com mais de quatrocentas horas. O exercício pleno das atividades ocorre após cinco an";"Alidade: qualquer dispositivo mecânico destinado a medir ângulos ou afastamentos angulares mediante alinhamento óptico. Calado: Distância vertical entre  a superfície da água em que a embarcação flutua e a face inferior da ";"Essas ocupações sujeitas às normas das autoridades marítimas (norma - 13/2000); da diretoria de portos e costas (dpc);.";"Técnicos marítimos, fluviários e pescadores de convés"
1387;"3422";"Trabalham prestando serviços de despacho aduaneiro a empresas agropecuárias, comerciais, industriais e de serviços, inclusive empresas e órgãos estatais. Trabalham por conta própria, em equipe e sem supervisão, exceto o ajudante";"Desembaraçam mercadorias e bagagens, requisitando vistoria aduaneira, formalizando desistência de vistoria aduaneira, pagando taxas e impostos e apresentando documentos à Receita federal e demais órgãos pertinentes. Os despachantes aduaneiros classificam mercadorias, analisando amostras, verificando funções, uso e material constitutivo de mercadorias e enquadrando mercadorias em sistemas de classificação e tarifação, tais como: tec, nesh, naladi, icms e tipi. Operam sistema de comércio exterior, registrando informações da operação de importação e exportação de mercadorias, assessoram importadores e exportadores, elaboram documentos de importação e exportação e contratam serviços de terceiros.";"O exercício dessas ocupações requer ensino médio completo.  O pleno desempenho das atividades ocorre após cinco anos de experiência (despachante aduaneiro); e de três a quatro anos (ajudante de despachante aduaneiro);. A(s); oc";"Conhecimento Internacional de Transporte: documento de atestado de transporte, pode ser aéreo (Airway Bill);, rodoviário (Conhecimento Rodoviário de Transporte);, ferroviário e marítimo. Drawback: devolução de direitos alfandeg";"Norma regulamentadora: portaria interministerial mf/mtb nº 209, de 10 de abril de 1980 - dispõe sobre a habilitação para o exercício da atividade de despachante aduaneiro e de ajudante de despachante aduaneiro, bem como sobre o registr";"Despachantes aduaneiros"
1394;"3423";"Atuam em empresas de transporte terrestre, na gestão, planejamento e fiscalização (técnicos do setor público); e na operação e execução de serviços (técnicos do setor privado);. São assalariados, com carteir";"Administram e controlam a frota de veículos no transporte rodoviário de cargas e passageiros. Supervisionam atividades de motoristas e auxiliares; checam e inspecionam documentação de motoristas e de veículos. Supervisionam embarque e desembarque de cargas e passageiros; inspecionam condições do veículo e da carga; preenchem e emitem documentos fiscais e de controle. Programam e controlam horários e gastos de viagens. Providenciam atendimento e assistência às vítimas e seus parentes, em caso de acidente, e acionam serviços de apoio e órgãos oficiais.";"O acesso a essas ocupações requer ensino técnico profissionalizante de ensino médio ou experiência equivalente construída em uma trajetória ocupacional nas empresas em que atuam. O exercício pleno das atividades ocorre ap";"";"";"Técnicos em transportes rodoviários"
1401;"3424";"Trabalham em ferrovias e metrôs, como empregados assalariados, com carteira assinada. Atuam em equipe na execução de trabalhos integrados e na elaboração de estratégias, com supervisão permanente. Trabalham em ambientes fechado";"Coordenam a circulação de trens e veículos metroferroviários de manutenção; controlam e programam horários de circulação de trens. Administram estação e controlam atividades de pátios e terminais; operam equipamentos e sistemas elétricos. Prestam serviços de apoio ao usuário e supervisionam equipe de trabalho. Preenchem relatórios, planilhas, documentos de despacho, diário operacional e boletins de ocorrência.";"O exercício dessas ocupações requer curso técnico de nível médio; há tendência de aumento dos requisitos de qualificação, em função da modernização dos sistemas de controle operacional. Parte do apre";"";"";"Técnicos em transportes metroferroviários"
1415;"3426";"Trabalham em empresas do ramo de transporte aquaviário e de companhias de operações portuárias. São contratados na condição de trabalhadores assalariados, com carteira assinada. Desenvolvem suas atividades em equipe, sob superv";"Supervisionam o recebimento de cargas e o embarque de  passageiros do transporte aquaviário; coordenam serviços de embarcação em portos e estações; organizam  distribuição de cargas e passageiros; programam  atracação de embarcações; monitoram  atracação e desatracação,  embarque e desembarque; elaboram documentos técnicos.";"O exercício dessas ocupações requer escolaridade de ensino técnico em transportes, em nível médio. O pleno exercício das atividades se dá após o período de cinco anos de experiência profissional. A(s); ocupaå";"OGMO: Órgão Gestor de Mão-de-obra; departamento de apoio dos portos e companhias de docas.";"";"Técnicos em transportes por vias navegáveis e operações portuárias"
1422;"3511";"Trabalham em escritórios de contabilidade, em departamentos de contabilidade de empresas agrícolas, comerciais, industriais e de serviços e em órgãos governamentais, como estatutários, empregados assalariados ou como autônomos ";"Realizam atividades inerentes contabilidade em empresas, órgãos governamentais e outras instituições públicas e privadas. Para tanto, constituem e regularizam empresa, identificam documentos e informações, atendem à fiscalização e procedem consultoria empresarial. Executam a contabilidade  geral, operacionalizam a contabilidade de custos e efetuam contabilidade gerencial. Administram o departamento pessoal e realizam controle patrimonial.";"O exercício dessas ocupações requer curso técnico em contabilidade (nível médio);. O exercício pleno das atividades ocorre após quatro anos de experiência. A(s); ocupação(ões); elencada(s); nesta família";"";"";"Técnicos em contabilidade"
1429;"3513";"Trabalham em qualquer atividade econômica onde haja atividades administrativas, na condição de assalariados com carteira assinada. O trabalho é presencial, executado em equipe, com supervisão ocasional. O ambiente de trabalho é fec";"Controlam rotina administrativa. Realizam atividades em recursos humanos e intermedeiam mão-de-obra para colocação e recolocação. Atuam na área de compras e assessoram a área de vendas. Intercambiam mercadorias e serviços e executam atividades nas áreas fiscal e financeira.";"Essas ocupações são exercidas por trabalhadores com formação de ensino médio completo, preferencialmente com o curso técnico de nível médio na área de atuação. O exercício pleno das ocupações oco";"Siscomex: sistema integrado de comércio exterior.";"";"Técnicos em administração"
1436;"3514";"Atuam em cartórios. São contratados em regime de clt, com carteira assinada. Organizam-se em equipe, sob supervisão permanente; trabalham em ambientes fechados, durante o dia e, por convocação, em qualquer horário e dia da semana. ";"Cumprem as determinações legais e judiciais atribuídas aos cartórios oficiais e extra-judiciais, lavrando atos, autuando processos, procedendo registros; expedem mandados, traslados, cartas precatórias e rogatórias e certidões; registram documentos; realizam diligências, tais como: citações, intimações, prisões e penhoras; prestam atendimento ao público, redigindo procurações, autenticando documentos. Coadjuvam as audiências; podem supervisionar uma equipe de serventuários. Lavram boletim de ocorrências em delegacias.";"Os requisitos de escolaridade dessas ocupações são heterogêneos, com critérios diferenciados por região do país ou estado da federação. Para o auxiliar de serviços jurídicos requer-se, no mínimo, ensino fund";"";"";"Serventuários da justiça e afins"
1443;"3515";"Trabalham em órgãos públicos e setores empresariais, tendo vínculo formal de emprego. Atuam de forma individual, normalmente sem supervisão e em ambientes fechados. Os horários são diurno para os taquígrafos e com revezamen";"Transformam a linguagem oral em escrita, registrando falas em sinais,  decodificando-os em texto; revisam textos e documentos; organizam as atividades gerais da área e assessoram o seu desenvolvimento; coordenam a execução de tarefas; redigem textos e comunicam-se, oralmente e por escrito.";"O exercício dessas ocupações requer curso técnico de nível médio completo para os técnicos em secretariado e estenotipista. A escolaridade para o taquígrafo pode variar de nível médio a superior completo. Adicionalm";"";"- norma regulamentadora: - lei nº 7.377*, de 30 de setembro de 1985 - dispõe sobre a profissão de secretário e dá outras providências . *  A  redação dos incisos i e ii do art. 2º, o caput do art. 3º, o  inc. Vi do ";"Técnicos em secretariado, taquígrafos e estenotipistas"
1457;"3517";"Trabalham em empresas de seguros e de previdência privada, empresas de economia mista e órgãos governamentais da área securitária. O trabalho é realizado em ambientes fechados, nos horários diurnos. São trabalhadores celeti";"Contatam corretores, segurados e equipe de trabalho, para comercializar seguros e para facilitar o relacionamento empresa-cliente; subscrevem e inspecionam riscos; operacionalizam cálculos de prémios e outros procedimentos para cessão e recuperação de resseguros e co-seguros; executam regulação e liquidação de sinistros. Desenvolvem novas modalidades de seguros. Elaboram documentação técnica.";"O exercício dessas ocupações requer escolaridade de nível médio e cursos profissionalizantes de duzentas a quatrocentas horas-aula. O pleno desempenho das atividades, ocorre após três a quatro anos de experiência. A(s); ocu";"Co-seguro: divisão de um risco segurado entre vários seguradores, ficando cada um deles responsável direto por uma quota-parte determinada do valor total do seguro (Glossário da Fenaseg);.  Resseguro: operação pela qual o segurador";"";"Técnicos de seguros e afins"
1464;"3518";"Investigadores de polícia e papiloscopistas policiais trabalham em órgãos da administração pública, de segurança e defesa, como estatutários. Os detetives profissionais atuam em empresas de serviços pessoais ou por cont";"Investigam crimes; elaboram perícias de objetos, documentos e locais de crime; planejam investigações; efetuam prisões, cumprindo determinação judicial ou em flagrante delito; identificam pessoas e cadáveres, coletando impressões digitais, palmares e plantares. Atuam na prevenção de crimes; gerenciam crises, socorrendo vítimas, intermediando negociações e resgatando reféns; organizam registros papiloscópicos e custodiam presos. Registram informações em laudos, boletins e relatórios; colhem depoimentos e prestam testemunho.";"O exercício dessas ocupações requer escolaridade de nível médio e formação profissional de duzentas a quatrocentas horas-aula (investigadores policiais); e mais de quatrocentas horas-aula (detetives profissionais);. Os papilosc";"Confeccionar luvas cadavéricas:  restaurar, hidratar dedo para recuperar impressão dígito-papilar; Custodiar presos e deter presos: são atribuições dos carcereiros que, em alguns casos, podem ficar a cargo dos investigadores de pol";"";"Agentes de investigação e identificação"
1471;"3522";"Esses profissionais atuam, predominantemente, nas áreas ligadas à agricultura, pecuária, silvicultura, exploração florestal, pesca, aquicultura e serviços relacionados. São empregados com carteira e trabalham em equipe, com";"Orientam e fiscalizam as atividades e obras para prevenção/preservação ambiental e da saúde, por meio de vistorias, inspeções e análises técnicas de locais, atividades, obras, projetos e processos, visando o cumprimento da legislação ambiental e sanitária; promovem educação sanitária e ambiental.";"A escolaridade para ocupar esses empregos/ocupações varia do ensino médio ao ensino superior, incompleto ou completo, de várias áreas do conhecimento como: biologia, engenharia, etc., Além de curso básico de qualificaçã";"";"";"Agentes da saúde e do meio ambiente"
1478;"3523";"Trabalham em órgãos de fiscalização metrológica, como os institutos de pesos e medidas. São empregados assalariados, com carteira assinada, que se organizam em equipe, sob supervisão permanente. O local de trabalho pode ser fec";"Fiscalizam instrumentos de medição, medidas materializadas, produtos, marcas de conformidade e serviços, conforme legislação. Verificam instrumentos e medidas materializadas; realizam testes, análises e calibrações. Registram o processo de fiscalização, verificação e calibração; supervisionam atividades metrológicas; orientam o público; formam recursos humanos na área de metrologia.";"O exercício profissional dessas ocupações requer curso técnico em metrologia (nível médio);, curso técnico na área têxtil ou outra área de fiscalização, seguido de especialização de duzentas a quatro";"";"";"Agentes  fiscais metrológicos e de qualidade"
1492;"3532";"Trabalham em bancos e outras instituições de intermediação financeira como empregados assalariados, com registro em carteira; organizam-se em equipe, sob supervisão permanente, em ambientes fechados, nos horários diurnos, sob condi";"Processam operações de crédito, investimento e serviços bancários, obedecendo normas externas, emanadas de órgãos governamentais, e internas, da instituição que os empregam. Controlam as operações de concessão de crédito, investimento e serviços a pessoas físicas ou jurídicas, a fim de cumprir e fazer cumprir as normas e regras internas e de órgãos regulamentadores, tais como: banco central do brasil e secretaria da receita federal, entre outros. Atendem aos demais setores do banco, como seus clientes internos, e a órgãos governamentais, outros bancos e ao público em geral, como clientes externos, prestando-lhes informações sobre assuntos de sua competência. Podem coordenar recursos humanos, sob sua responsabilidade e exercer o monitoramento de serviços prestados por terceiros.";"Para o exercício dessas ocupações requer-se formação de nível médio, seguida de cursos orientados para o trabalho,  nas próprias instituições. O pleno desempenho das atividades ocorre após um a dois anos de experiÃ";"";"";"Técnicos em operações e serviços bancários"
1506;"3542";"Trabalham na agroindústria, no comércio atacadista e varejista, nas indústrias e no setor de serviços. São assalariados, com carteira assinada, trabalham de forma individual, sob supervisão, em ambientes fechados, no período di";"Recebem requisições de compras, executam processo de cotação e concretizam a compra de serviços, produtos, matérias-primas e equipamentos  para o comércio atacadista e varejista, para indústrias,  empresas, órgãos públicos e privados.  Acompanham o fluxo de entregas, desenvolvem fornecedores de materiais e serviços; supervisionam equipe e processos de compra. Preparam relatórios e fazem o papel de interlocutor entre requisitantes e fornecedores.";"O exercício dessas ocupações requer ensino médio até ensino superior incompleto, dependendo da natureza dos produtos comprados. O pleno desempenho das atividades ocorre após três a quatro anos (comprador); e mais cinco anos (su";"";"";"Compradores"
1513;"3543";"Trabalham em agroindústrias, indústrias, empresas de importação e exportação, cooperativas, bancos, multinacionais, empresas de transporte, empresas aduaneiras e de câmbio, consultorias, assessoramento empresarial, empresas pre";"Realizam operações de comércio internacional para importação e exportação de produtos e serviços; processam operações de importação; traçam planos de exportação; analisam mercado internacional de produtos e serviços; participam da promoção de produtos ou serviços em feiras e outros eventos, prestando orientação técnica aos visitantes ou participantes; orientam o desembaraço aduaneiro. Podem expressar-se em língua estrangeira.";"O exercício dessas ocupações requer curso superior em comércio exterior ou curso superior em outra área, com especialização em comércio exterior. O desempenho pleno das atividades ocorre após quatro a cinco anos de expe";"";"";"Analistas de comércio exterior"
1520;"3544";"Prestam serviços a pessoas, instituições públicas e privadas. Atuam em atividades imobiliárias, de extração de minerais, empresariais e artísticas, podendo, os leilões, serem feitos para indústrias, comércio ou ";"Captam, avaliam, oficializam, divulgam, administram e organizam leilões de bens móveis e imóveis, novos ou usados e semoventes. Emitem pareceres técnicos e comerciais sobre os bens a serem leiloados ou comercializados.";"O exercício profissional é aberto a brasileiros, maiores de vinte e cinco anos que cumpram exigências de legislação específica. Os trabalhadores que exercem essas ocupações possuem escolaridade variada. Em geral, complement";"";"Norma regulamentar: decreto nº 21.981, de 19 de outubro de 1932 - regula a profissão de leiloeiro no território da república. Instrução normativa n° 83, de 7 de janeiro de 1999, dispõe sobre a matrícula e seu cancelamen";"Leiloeiros e avaliadores"
1527;"3545";"Trabalham na área de seguros e previdência privada. Enquanto pessoas físicas, trabalham por conta própria. Enquanto pessoas jurídicas, mantêm uma equipe de corretagem, sob sua supervisão.";"Vendem apólices de seguros de vida, de automóvel, de previdência privada, de incêndios, de riscos marítimos e outros ramos de seguros; relacionam-se com companhia seguradora e prestam assistência ao segurado; empregam técnicas de vendas e operacionalizam rotinas informatizadas. Podem administrar a corretora.";"Para o exercício profissional, em todos os ramos de seguro, requer-se habilitação em curso da fundação escola nacional de seguros (funaseg);. Há, também, treinamentos para qualificação em modalidades específicas de ";"";"Norma regulamentadora: lei nº 4.594, de 29 de dezembro de 1964. Regula a profissão de corretor de seguros.  Decreto nº 56.903, de 24 de setembro de 1965. Regulamenta a profissão de corretor de seguros de vida e da capitalização, de";"Corretores de seguros"
1534;"3546";"Trabalham em imobiliárias, como autônomos, empregados ou empregadores. O trabalho é presencial ou a distância; pode ser realizado de forma individual ou em equipe, com ou sem  supervisão. Atuam em ambientes fechados, a céu aberto o";"Intermedeiam compra, venda, permuta, locação e administração de imóveis e solicitam documentação. Para tanto, entrevistam clientes, pesquisam mercado e captam imóveis e elaboram estratégias de comercialização. Podem assessorar os clientes após transação.";"O exercício dessa ocupação requer curso técnico de nível médio e registro no creci.";"";"Norma regulamentadora: lei nº 6.530, de 12 de maio de 1978 -  dá nova regulamentação a profissão de corretor de imóveis, disciplina o funcionamento de seus órgãos de fiscalização e dá outras providências.  D";"Corretores de imóveis"
1541;"3547";"Exercem suas funções, predominantemente, como representantes de empresas industriais, comerciais e de serviços. Atuam por conta própria e também como empregadores. Trabalham de forma individual,  em horários irregulares, sem superv";"Intermedeiam negócios mercantis para terceiros, utilizando mostruários, catálogos, panfletos e quaisquer outros meios ou instrumentos que possam facilitar as negociações junto  ́ clientela. Planejam vendas,  divulgam e demonstram produtos e serviços e finalizam vendas. Acompanham clientes pós-venda; interagem com as demais áreas da empresa representada e participam de eventos.";"Para o exercício dessa ocupação requer-se escolaridade mínima de nível médio. Em alguns tipos de atividade é requerido curso básico de até duzentas horas-aula. A(s); ocupação(ões); elencada(s); nesta famå";"";"Norma regulamentadora :  lei nº4.886, de  9 de dezembro de 1965 - regula as atividades dos representantes comerciais autônomos.  Lei nº 8.420, de 8 de maio de 1992 - introduz alterações na lei nº 4.886/1965, que regula as atividade";"Representantes comerciais autônomos"
1562;"3712";"Trabalham em museus e arquivos, em entidades culturais e de ensino, em setores de documentação de empresas, fundações e outras instituições públicas e privadas, em geral de porte médio ou grande. Geralmente são empregad";"Auxiliam especialistas das diversas áreas de museus, nos trabalhos de organização, conservação, pesquisa e difusão de documentos e objetos de caráter histórico, artístico, científico, literário ou de outra natureza.";"Para o acesso à ocupação de técnico em museologia requer-se formação de nível médio. O aprendizado dos profissionais que atuam com coleções de selos e moedas ocorre na prática. Para o exercício pleno das ati";"";"Norma regulamentadora: lei nº 6.546, de 4 de julho de 1978 - dispõe sobre a regulamentação de arquivista e técnico de arquivo. Decreto nº 82.590, de 6 de novembro de 1985 - regulamenta a lei nº 6.546, de 4/7/78. O técnico d";"Técnicos em museologia e afins"
